{
  "schema_version": 1,
  "document_id": "incident",
  "root_prefix": "Answer using only the selected Markdown section and the shared document context. Reply with the requested value only.\n\nDocument: incident\nShared Markdown:\n# Incident response notes\n\n\n",
  "nodes": [
    {
      "id": "n0",
      "path": "",
      "parent": null,
      "node_type": "document",
      "text": "Answer using only the selected Markdown section and the shared document context. Reply with the requested value only.\n\nDocument: incident\nShared Markdown:\n# Incident response notes\n\n\n",
      "tokens": [
        128000,
        16533,
        1701,
        1193,
        279,
        4183,
        74292,
        3857,
        323,
        279,
        6222,
        2246,
        2317,
        13,
        18321,
        449,
        279,
        11472,
        907,
        1193,
        382,
        7676,
        25,
        10672,
        198,
        17430,
        74292,
        512,
        2,
        69835,
        2077,
        8554,
        1432
      ],
      "positions": [
        0,
        1,
        2,
        3,
        4,
        5,
        6,
        7,
        8,
        9,
        10,
        11,
        12,
        13,
        14,
        15,
        16,
        17,
        18,
        19,
        20,
        21,
        22,
        23,
        24,
        25,
        26,
        27,
        28,
        29,
        30,
        31,
        32
      ],
      "seq_ids": [
        [
          0,
          1
        ],
        [
          0,
          1
        ],
        [
          0,
          1
        ],
        [
          0,
          1
        ],
        [
          0,
          1
        ],
        [
          0,
          1
        ],
        [
          0,
          1
        ],
        [
          0,
          1
        ],
        [
          0,
          1
        ],
        [
          0,
          1
        ],
        [
          0,
          1
        ],
        [
          0,
          1
        ],
        [
          0,
          1
        ],
        [
          0,
          1
        ],
        [
          0,
          1
        ],
        [
          0,
          1
        ],
        [
          0,
          1
        ],
        [
          0,
          1
        ],
        [
          0,
          1
        ],
        [
          0,
          1
        ],
        [
          0,
          1
        ],
        [
          0,
          1
        ],
        [
          0,
          1
        ],
        [
          0,
          1
        ],
        [
          0,
          1
        ],
        [
          0,
          1
        ],
        [
          0,
          1
        ],
        [
          0,
          1
        ],
        [
          0,
          1
        ],
        [
          0,
          1
        ],
        [
          0,
          1
        ],
        [
          0,
          1
        ],
        [
          0,
          1
        ]
      ],
      "merged_into": null
    },
    {
      "id": "n1",
      "path": "/sections/Severity rules",
      "parent": "n0",
      "node_type": "section",
      "text": "\nSection: Severity rules\nMarkdown:\n## Severity rules\n\nCustomer data exposure is assigned severity P1. The incident lead opens an immediate response and records the affected service.\n\n1. Confirm the exposure.\n2. Mark the incident P1.\n3. Start containment.\n\n\n",
      "tokens": [
        198,
        9817,
        25,
        52239,
        5718,
        198,
        69105,
        512,
        567,
        52239,
        5718,
        271,
        13084,
        828,
        14675,
        374,
        12893,
        31020,
        393,
        16,
        13,
        578,
        10672,
        3063,
        16264,
        459,
        14247,
        2077,
        323,
        7576,
        279,
        11754,
        2532,
        382,
        16,
        13,
        34663,
        279,
        14675,
        627,
        17,
        13,
        4488,
        279,
        10672,
        393,
        16,
        627,
        18,
        13,
        5256,
        46311,
        4286
      ],
      "positions": [
        33,
        34,
        35,
        36,
        37,
        38,
        39,
        40,
        41,
        42,
        43,
        44,
        45,
        46,
        47,
        48,
        49,
        50,
        51,
        52,
        53,
        54,
        55,
        56,
        57,
        58,
        59,
        60,
        61,
        62,
        63,
        64,
        65,
        66,
        67,
        68,
        69,
        70,
        71,
        72,
        73,
        74,
        75,
        76,
        77,
        78,
        79,
        80,
        81,
        82,
        83,
        84,
        85
      ],
      "seq_ids": [
        [
          0
        ],
        [
          0
        ],
        [
          0
        ],
        [
          0
        ],
        [
          0
        ],
        [
          0
        ],
        [
          0
        ],
        [
          0
        ],
        [
          0
        ],
        [
          0
        ],
        [
          0
        ],
        [
          0
        ],
        [
          0
        ],
        [
          0
        ],
        [
          0
        ],
        [
          0
        ],
        [
          0
        ],
        [
          0
        ],
        [
          0
        ],
        [
          0
        ],
        [
          0
        ],
        [
          0
        ],
        [
          0
        ],
        [
          0
        ],
        [
          0
        ],
        [
          0
        ],
        [
          0
        ],
        [
          0
        ],
        [
          0
        ],
        [
          0
        ],
        [
          0
        ],
        [
          0
        ],
        [
          0
        ],
        [
          0
        ],
        [
          0
        ],
        [
          0
        ],
        [
          0
        ],
        [
          0
        ],
        [
          0
        ],
        [
          0
        ],
        [
          0
        ],
        [
          0
        ],
        [
          0
        ],
        [
          0
        ],
        [
          0
        ],
        [
          0
        ],
        [
          0
        ],
        [
          0
        ],
        [
          0
        ],
        [
          0
        ],
        [
          0
        ],
        [
          0
        ],
        [
          0
        ]
      ],
      "merged_into": null
    },
    {
      "id": "n2",
      "path": "/sections/Notification route",
      "parent": "n0",
      "node_type": "section",
      "text": "\nSection: Notification route\nMarkdown:\n## Notification route\n\nThe first notification goes through EMAIL. The on-call coordinator then confirms that the message was received.\n\n```text\nnotify=EMAIL\n```\n\n",
      "tokens": [
        198,
        9817,
        25,
        16980,
        6149,
        198,
        69105,
        512,
        567,
        16980,
        6149,
        271,
        791,
        1176,
        11801,
        5900,
        1555,
        52808,
        13,
        578,
        389,
        59997,
        31384,
        1243,
        43496,
        430,
        279,
        1984,
        574,
        4036,
        382,
        74694,
        1342,
        198,
        22714,
        28,
        37004,
        198,
        14196,
        19884
      ],
      "positions": [
        33,
        34,
        35,
        36,
        37,
        38,
        39,
        40,
        41,
        42,
        43,
        44,
        45,
        46,
        47,
        48,
        49,
        50,
        51,
        52,
        53,
        54,
        55,
        56,
        57,
        58,
        59,
        60,
        61,
        62,
        63,
        64,
        65,
        66,
        67,
        68,
        69,
        70,
        71,
        72
      ],
      "seq_ids": [
        [
          1
        ],
        [
          1
        ],
        [
          1
        ],
        [
          1
        ],
        [
          1
        ],
        [
          1
        ],
        [
          1
        ],
        [
          1
        ],
        [
          1
        ],
        [
          1
        ],
        [
          1
        ],
        [
          1
        ],
        [
          1
        ],
        [
          1
        ],
        [
          1
        ],
        [
          1
        ],
        [
          1
        ],
        [
          1
        ],
        [
          1
        ],
        [
          1
        ],
        [
          1
        ],
        [
          1
        ],
        [
          1
        ],
        [
          1
        ],
        [
          1
        ],
        [
          1
        ],
        [
          1
        ],
        [
          1
        ],
        [
          1
        ],
        [
          1
        ],
        [
          1
        ],
        [
          1
        ],
        [
          1
        ],
        [
          1
        ],
        [
          1
        ],
        [
          1
        ],
        [
          1
        ],
        [
          1
        ],
        [
          1
        ],
        [
          1
        ]
      ],
      "merged_into": null
    },
    {
      "id": "n3",
      "path": "/sections/Severity rules/blocks/1",
      "parent": "n1",
      "node_type": "list",
      "text": "",
      "tokens": [],
      "positions": [],
      "seq_ids": [],
      "merged_into": "n1"
    },
    {
      "id": "n4",
      "path": "/sections/Severity rules/blocks/2",
      "parent": "n3",
      "node_type": "list_item",
      "text": "",
      "tokens": [],
      "positions": [],
      "seq_ids": [],
      "merged_into": "n1"
    },
    {